"85","Low Carbon West Oxford","","","","Oxford","OX2 0ET","","info@lcwo.org.uk","","https://www.lowcarbonwestoxford.org.uk","https://www.facebook.com/lowcarbonwestoxford/","@Low_Carbon_West","No","","No","","No","","No","","No","","No","","No","","N/A","Mobile: 7932073091","Low Carbon West Oxford (LCWO) was set up after the summer floods of 2007 by residents concerned about climate change and local flooding. It is a community-led initiative which aims to combat climate change by cutting their community’s carbon dioxide emissions by 80 % by 2050, encouraging residents to live more sustainably, and contributing to a more cohesive and resilient community. They seek to work in an inclusive manner and ensure that everyone who lives and works in the area has a chance to participate in and benefit from LCWO’s projects.","No","No","Yes","No","No","No","No","No","Yes","No","No","No","No","No","No","No","No","Campaigning, Activism & Advocacy","No","No","No","No","Yes","No","No","No","No","No","Yes","Yes","We are part of a network with two local initiative, WOCORe and Osney Lock Hydro – read more about the West Oxford Model here: https://www.lowcarbonwestoxford.org.uk/the-west-oxford-model/
Formal network of CAGs - Community Action Groups - in Oxfordshire
Also part of various informal sub groups working on different particular issues
In addition, we work closely with others through Low Carbon Oxford's Oxford Green Week, Bioregional's One Planet Oxfordshire, Oxfordshire Together on Climate Change and with the Low Carbon Hub - and frequently partner with other groups and networks (both formal and informal) on particular events and topics.","Yes"
"86","South Oxford Farmers and Community Market","South Oxford Community Centre","Lake Street","","Oxford","OX1 4RP","","info@southoxfordfarmersmarket.org.uk	","","http://www.southoxfordfarmersmarket.org.uk/","https://www.facebook.com/southoxfordfarmersmarket","","No","","No","","No","","No","","No","","No","","Yes","9:30 – 12:00","N/A","Tel: 01865 248973","The South Oxford Farmers and Community Market (SOFACOMA) is a weekly market selling ethically-produced local, seasonal and/or organic food and non-food goods. We define ‘local’ as being produced within a 30-mile radius of Oxford; and ‘produced’ as containing a significant quantity of local ingredients and labour. The South Oxford Farmers and Community Market is an initiative of the Low Carbon South Oxford (LCSO) Sustainable Food Group which supports the promotion of local food as a way of helping to combat climate change by reducing the amount of carbon released in the transport of food over long distances.","No","No","Yes","No","No","Yes","No","No","No","No","No","No","No","No","No","No","No","Food","No","No","No","No","No","No","Yes","No","No","No","No","No","Kind of. There is an Oxford Community Markets group but it is pretty dormant. We are part of the Low Carbon South Oxford group (also fairly dormant as a committee) which is a CAG member.","Yes"
"87","Oxford GreenPrint","East Oxford Community Centre","OARC (Room 1) upstairs","44 Princes Street","Oxford","OX4 1DD","","mail@oxfordgreenprint.com","01865 682819","http://oxfordgreenprint.com/","https://www.facebook.com/oxfordgreenprint/","@OxGreenPrint","Yes","12:00 – 14:00 or by arrangement outside these times","Yes","12:00 – 14:00 or by arrangement outside these times","Yes","12:00 – 14:00 or by arrangement outside these times","Yes","12:00 – 14:00 or by arrangement outside these times","Yes","12:00 – 14:00 or by arrangement outside these times","Yes","Closed","Yes","Closed","N/A","Tel: 01865 682819 / Email: mail@oxfordgreenprint.com","Oxford GreenPrint is a workers’ co-operative providing ethical, low impact printing to community groups, campaign groups, NGOs and businesses both in Oxford and across the UK. All their printing is done on recycled paper or card using renewable energy.","Yes","No","Yes","Yes","Yes","No","No","No","No","No","Yes","No","No","No","No","No","No","Goods & Services","No","No","No","No","No","No","No","No","No","No","No","No","","Yes"
"88","Abingdon Carbon Cutters","St Ethelwolds House","30 East St Helen Street","","Abingdon","OX14 3EB","","carbon.cutters@gmail.com","","http://abingdoncarboncutters.org.uk","https://www.facebook.com/AbingdonCarbonCutters","@AbCarbonCutters","No","","No","","No","","No","","No","","No","","No","","N/A","Mob: 07786 055195","Abingdon Carbon Cutters is a Community Action Group working in and around Abingdon to:
•	help reduce the carbon footprint of Abingdon in response to climate change;
•	promote a sustainable and resilient lifestyle for our town as fossil fuel stocks decline;
•	promote a range of activities consistent with the status of Abingdon as a community in Transition.
They focus on issues relating to food, waste reduction, energy, education and transport.","Yes","No","Yes","No","No","Yes","No","No","No","No","No","No","No","No","No","No","No","Campaigning, Activism & Advocacy","No","No","No","Yes","Yes","Yes","No","No","No","No","Yes","Yes","CAG and Transition Network.","Yes"
"89","Oxford Permaculture Picturehouse","East Oxford Community Centre","44 Princes Street","","Oxford","OX4 1DD","","","","","","","No","","No","","No","","No","","No","","No","","No","","Antony Melville","Email: antonymelville@gmail.com / Mobile: 07732628174","Oxford Permaculture Picturehouse aims to bring people together around films in sympathy with permaculture, promoting permaculture messages and know-how, but most of all reinforcing the network of interested people. Films are usually screened on the 4th Monday of the month at the East Oxford Community Centre.","No","No","No","No","No","Yes","No","No","No","No","No","No","No","No","No","No","No","Arts, Media, Culture & Leisure","No","No","No","No","No","Yes","No","No","No","No","Yes","No","","Yes"
"90","New Internationalist Publications Ltd","The Old Music Hall","106-108 Cowley Road","","Oxford","OX4 1JE","","","01865 403345","https://newint.org","https://www.facebook.com/newint","@newint","No","","No","","No","","No","","No","","No","","No","","Katalin Szombati","Email: katalin.szombati@newint.org","New Internationalist is a leading independent media organization dedicated to socially conscious journalism and publishing. They are an independent, not-for-profit media multi-stakeholder co-operative, owned by their workers and over 3,600 investors. They tell the stories that the mainstream media sidestep and offer a platform for the people living those stories. Their award-winning magazine, books and website set the agenda for a radically fairer future, promote global justice and campaign for the disadvantaged all over the world.","Yes","Yes","Yes","Yes","Yes","No","No","No","No","No","No","No","No","No","Yes","No","No","Arts, Media, Culture & Leisure","No","Yes","No","Yes","No","No","Yes","No","No","No","No","No","","Yes"
"91","We Own It","The Old Music Hall","106-108 Cowley Road","","Oxford","OX4 1JE","","info@weownit.org.uk","01865 403251","https://weownit.org.uk/","https://www.facebook.com/WeOwnItCampaign","@We_OwnIt	","No","","No","","No","","No","","No","","No","","No","","Cat Hobbs","Email: info@weownit.org.uk / Phone: 01865403251","We Own It’s mission is to end privatisation for good so that people come before profit. We believe public services should belong to all of us - whether that's the NHS, schools, water, energy, rail, Royal Mail, care work or council services. Our work focuses on two things: campaigning against privatisation, and making the case for public ownership.  ","No","No","No","No","Yes","No","Yes","No","No","Yes","No","No","No","No","No","No","No","Campaigning, Activism & Advocacy","No","No","No","No","No","No","No","No","No","No","No","No","We collaborate with campaigns to protect specific services, like Keep Our NHS Public, the Anti-Academies Alliance, etc. We don't duplicate their work, but amplify it when we can. We're also part of the New Economy Organisers Network and have benefitted from their spokesperson network training, press officer training, and organisation building workshops.","Yes"
"92","Project SOUP","Oxford Hub","17 Turl Street","","Oxford","OX1 3DH","","projectsoupoxford@gmail.com","","https://projectsoupoxford.weebly.com/","https://www.facebook.com/projectsoupoxford/","@projectsoupoxf","No","","No","","No","","No","","No","","No","","No","","N/A","Email: projectsoupoxford@gmail.com","Since its inception in 2013, Project SOUP (Support Oxford's Upcoming Projects) has been committed to combatting local issues and being a driving force for change in the Oxford community. Project SOUP brings together the people behind new community project ideas and the people that want to help make them happen. Together they enable people to support local projects in an effective way via a simple, democratic vote over a delicious dinner, made from surplus food. 
They hold one soup-filling, heart-warming event per Oxford academic term. At each event, 3-4 local social action groups/charities are invited to speak about their work, ‘pitch’ an idea to try and persuade the audience for their vote. After all the votes have been counted, a winner is announced and all the money on the door and extra donations goes directly to them.","Yes","Yes","Yes","No","No","Yes","Yes","Yes","No","No","No","No","No","No","No","No","No","Campaigning, Activism & Advocacy","No","No","No","No","No","Yes","No","No","No","No","No","No","Informal: 
•	Amy Kaherl's Movement (Who started the SOUP Movement in Detroit) - part of an online group of people who share updates/ stories etc
•	UK SOUP organisers - we share updates/resources through this 
Formal:
•	Part of Community Action Groups Oxfordshire (CAG)
•	Part of the Oxford Hub","Yes"
"94","Rose Hill Community Cupboard","Rose Hill Methodist Church","34 Singletree","Rose Hill","Oxford","OX4 4JP","","","","","","","No","","No","","No","","Yes","13:30 – 15:30","No","","No","","No","","N/A	","Email: billethebus70@yahoo.com","Rose Hill Community Cupboard provides food and essential items to people who need it the most. They help people by serving a cuppa and a snack and sending them home with a loaf and a nutritious bag of fresh fruit and veg. Visitors can chat, colour and play games while waiting to choose some groceries at the drop-in centre at Rose Hill Methodist Church one afternoon a week.","No","No","No","No","No","Yes","No","No","No","No","No","No","No","No","No","No","No","Food","No","No","Yes","No","No","No","Yes","No","No","No","No","Yes","We are served by the Food Bank.","Yes"
"95","Orinoco Scrapstore","Bullingdon Community Centre","Peat Moors","","Oxford","OX3 7HU","","oxorinoco@gmail.com","01865 761113","https://orinocoscrapstore.wordpress.com/","https://www.facebook.com/Oxorinoco/","","Yes","Closed","Yes","11:00 – 16:00","Yes","Closed","Yes","11:00 – 16:00","Yes","Closed","Yes","11:00 – 16:00","Yes","Closed","Emma Gordon","Email: emma@oxorinoco.org  / Phone: 01865 761113","Orinoco’s mission is to banish boredom and save the planet using creativity and play to inspire the reuse of materials. Over its 25 year history, Orinoco has saved lorry loads of interesting resources from ending up in landfill. Their Scrapstore in Headington sells scrap items for art, crafts, play and creative projects as well as new art materials, refurbished tools and DIY stuff. They collect suitable waste materials from businesses for potential reuse; accept usable garden and workshop tools; and hold a monthly ‘Swap Shop’ on the second Saturday of every month for usable household items people may no longer need or want. ","No","No","Yes","No","No","No","Yes","No","Yes","No","No","No","No","No","No","No","No","Reduce, Reuse, Repair & Recycle","Yes","No","No","Yes","No","No","No","No","No","No","No","No","We were - Reuseful UK were a charity the manager a scrap store network. They dissolved last week! And are being replaced by a website www.scrapstorenetwork.co.uk. which may be useful.","Yes"
"96","Oxfordshire Asian Women's Voice","Rose Hill Community Centre","Carole’s Way","Rose Hill","Oxford	","OX4 4HF","","oxfordshireasianwomensvoice@gmail.com","","","","","No","","No","","No","","Yes","12:30 – 14:30","No","","No","","No","","N/A (From email provided: Shahzadi Sabeena ???)","Email: shahzadisabeena786@hotmail.com / Phone: 7865958040","Oxfordshire Asian Women's Voice was set up 7 months ago to provide support and advice to Asian women in their native language. We respond to the needs and requests from our members, providing support in a range of areas from learning new skills to accessing services and support against domestic violence.","Yes","Yes","No","No","No","Yes","No","No","No","No","No","No","No","No","No","No","No","Health, Social Care & Wellbeing","No","No","No","No","No","No","No","No","No","No","No","No","","Yes"

